{"$schema":"https://json-schema.org/draft/2020-12/schema","$id":"https://axm.local/schemas/profession-research-packet.schema.json","title":"AXM Profession Research Packet","type":"object","additionalProperties":false,"required":["schema_version","profession_id","research_state","researched_on","body_snapshot","coverage","source_versions","crosswalks","findings","gaps_against_body","contradictions","nonclaims","high_stakes"],"properties":{"schema_version":{"const":"0.1"},"profession_id":{"type":"string","pattern":"^[a-z0-9]+(?:-[a-z0-9]+)*$"},"research_state":{"enum":["BASELINED","DOMAIN_GROUNDED","PRACTICE_GROUNDED","BODY_REVIEWED"]},"researched_on":{"type":"string","minLength":1},"body_snapshot":{"type":"object","additionalProperties":false,"required":["repository","ref","path","git_blob_sha"],"properties":{"repository":{"type":"string","minLength":1},"ref":{"type":"string","minLength":1},"path":{"type":"string","minLength":1},"git_blob_sha":{"type":"string","pattern":"^[0-9a-f]{40}$"}}},"coverage":{"type":"object","additionalProperties":false,"required":["occupational_baseline","domain_framework","observed_practice","body_review"],"properties":{"occupational_baseline":{"type":"boolean"},"domain_framework":{"type":"boolean"},"observed_practice":{"type":"boolean"},"body_review":{"const":true}}},"source_versions":{"type":"array","minItems":1,"items":{"$ref":"#/$defs/source_use"}},"crosswalks":{"type":"array","items":{"$ref":"#/$defs/crosswalk"}},"findings":{"type":"array","minItems":1,"items":{"$ref":"#/$defs/finding"}},"gaps_against_body":{"type":"array","items":{"$ref":"#/$defs/gap"}},"contradictions":{"type":"array","items":{"$ref":"#/$defs/contradiction"}},"nonclaims":{"$ref":"#/$defs/string_list"},"high_stakes":{"type":"object","additionalProperties":false,"required":["is_high_stakes","authorization_nonclaim"],"properties":{"is_high_stakes":{"type":"boolean"},"authorization_nonclaim":{"type":"string","minLength":1}}}},"$defs":{"string_list":{"type":"array","items":{"type":"string","minLength":1}},"source_use":{"type":"object","additionalProperties":false,"required":["source_id","version","use_mode"],"properties":{"source_id":{"type":"string","minLength":1},"version":{"type":"string","minLength":1},"use_mode":{"enum":["adapted","referenced","crosswalk-only"]}}},"crosswalk":{"type":"object","additionalProperties":false,"required":["source_id","external_id","label","concept_type","relation","confidence","rationale"],"properties":{"source_id":{"type":"string","minLength":1},"external_id":{"type":"string","minLength":1},"label":{"type":"string","minLength":1},"concept_type":{"enum":["occupation","classification-unit","work-role","competency-area","standard","context-profile"]},"relation":{"enum":["exact","broader","narrower","partial","adjacent"]},"confidence":{"enum":["high","medium","low"]},"rationale":{"type":"string","minLength":1}}},"finding":{"type":"object","additionalProperties":false,"required":["id","layer","summary","source_ids","method_labels","transferability","body_action","body_area","rationale"],"properties":{"id":{"type":"string","pattern":"^[a-z0-9]+(?:-[a-z0-9]+)*$"},"layer":{"enum":["task","skill","knowledge","tool","work-context","education","credential","work-role","failure","handoff","safety","regulation","methodology"]},"summary":{"type":"string","minLength":1},"source_ids":{"$ref":"#/$defs/string_list"},"method_labels":{"$ref":"#/$defs/string_list"},"transferability":{"enum":["direct","bounded","adjacent","context-only"]},"body_action":{"enum":["covered","gap","repair-candidate","do-not-import"]},"body_area":{"type":"string","minLength":1},"rationale":{"type":"string","minLength":1}}},"gap":{"type":"object","additionalProperties":false,"required":["id","body_area","description","evidence_source_ids","proposed_action","priority","safety_or_authority_impact"],"properties":{"id":{"type":"string","pattern":"^[a-z0-9]+(?:-[a-z0-9]+)*$"},"body_area":{"type":"string","minLength":1},"description":{"type":"string","minLength":1},"evidence_source_ids":{"$ref":"#/$defs/string_list"},"proposed_action":{"enum":["research-more","repair-body","add-fixture","add-tool-contract","add-handoff","add-knowledge","add-procedure","keep-separated"]},"priority":{"enum":["high","medium","low"]},"safety_or_authority_impact":{"type":"boolean"}}},"contradiction":{"type":"object","additionalProperties":false,"required":["id","description","source_ids","status"],"properties":{"id":{"type":"string","minLength":1},"description":{"type":"string","minLength":1},"source_ids":{"$ref":"#/$defs/string_list"},"status":{"enum":["OPEN","BOUNDED","RESOLVED"]}}}}}