{"schema_version":"0.1","profession_id":"incident-response-specialist","research_state":"BODY_REVIEWED","researched_on":"2026-09-12","body_snapshot":{"repository":"mike-axiom-mir/axm-profession-fabric","ref":"growth/security-cohort-71-78","path":"professions/security-privacy/incident-response-specialist/body.json","git_blob_sha":"df55629bed02b6481fa0e80e5f1cb3783e6fad99"},"coverage":{"occupational_baseline":true,"domain_framework":true,"observed_practice":false,"body_review":true},"source_versions":[{"source_id":"onet-31.0","version":"31.0 (August 2026)","use_mode":"adapted"},{"source_id":"nist-nice-2.2.0","version":"2.2.0 (28 Apr 2026)","use_mode":"adapted"}],"crosswalks":[{"source_id":"onet-31.0","external_id":"15-1212.00","label":"Information Security Analysts","concept_type":"occupation","relation":"partial","confidence":"high","rationale":"O*NET includes response to computer security breaches within Information Security Analysts, grounding part of incident-response work."},{"source_id":"nist-nice-2.2.0","external_id":"PD-WRL-003","label":"Incident Response","concept_type":"work-role","relation":"partial","confidence":"high","rationale":"NICE current components provide incident-response task/knowledge/skill context; organizational command authority remains separate."}],"findings":[{"id":"incident-response-specialist-occupational-boundary","layer":"methodology","summary":"Incident Response must preserve incident-state uncertainty and integrate response/recovery with broader risk management while separating service recovery, eradication, forensics, privacy and risk acceptance.","source_ids":["onet-31.0","nist-nice-2.2.0"],"method_labels":["O*NET 31.0 occupational comparison","NICE Framework Components v2.2.0 crosswalk"],"transferability":"bounded","body_action":"repair-candidate","body_area":"maps/evidence","rationale":"Research-backed boundary is compiled into package-local machinery."}],"gaps_against_body":[{"id":"incident-response-specialist-boundary-gap","body_area":"maps/evidence","description":"Make suspected-versus-confirmed, containment authority and recovery-versus-resolution boundaries explicit.","evidence_source_ids":["onet-31.0","nist-nice-2.2.0"],"proposed_action":"add-handoff","priority":"high","safety_or_authority_impact":true}],"contradictions":[],"nonclaims":["No complete Incident Response Specialist reconstruction is claimed.","No TEST/WORKING/CANON or adjacent authority is created."],"high_stakes":{"is_high_stakes":true,"authorization_nonclaim":"No technical access, package construction, role label, model capability or repository permission creates legal, security, safety, privacy, risk, product or institutional authority."}}