{"schema_version":"0.1","profession_id":"graphics-engineer","research_state":"BODY_REVIEWED","researched_on":"2026-09-12","body_snapshot":{"repository":"mike-axiom-mir/axm-profession-fabric","ref":"growth/research-first-cohort-36-40","path":"professions/software/graphics-engineer/body.json","git_blob_sha":"c483c37a6c965e4ede4a81e5c8542035ff825967"},"coverage":{"occupational_baseline":true,"domain_framework":false,"observed_practice":false,"body_review":true},"source_versions":[{"source_id":"onet-31.0","version":"31.0 (August 2026)","use_mode":"adapted"}],"crosswalks":[{"source_id":"onet-31.0","external_id":"15-1252.00","label":"Software Developers","concept_type":"occupation","relation":"partial","confidence":"high","rationale":"Software Developers ground graphics software implementation, performance and hardware/software interaction but do not isolate rendering pipelines or GPU-specific evidence."},{"source_id":"onet-31.0","external_id":"27-1014.00","label":"Special Effects Artists and Animators","concept_type":"occupation","relation":"adjacent","confidence":"medium","rationale":"Special Effects Artists and Animators provide adjacent visual-production evidence that helps preserve the distinction between renderer engineering and visual/art authorship."}],"findings":[{"id":"graphics-engineer-occupational-core","layer":"task","summary":"O*NET software work grounds implementation/performance while adjacent visual-production work confirms that graphics engineering intersects but does not own authored visual/art outcomes.","source_ids":["onet-31.0"],"method_labels":["O*NET 31.0 Software Developer and Special Effects Artist occupational comparison"],"transferability":"bounded","body_action":"covered","body_area":"scope/skills/procedures","rationale":"The body narrows the software baseline into renderer/shader/artifact/performance machinery and explicitly retains art-direction boundaries."},{"id":"graphics-engineering-art-separation","layer":"handoff","summary":"Renderer correctness/performance evidence must remain distinct from aesthetic, asset-authoring and gameplay-readability judgment even when the same rendered artifact is shared.","source_ids":["onet-31.0"],"method_labels":["Cross-occupation software/visual-production boundary review"],"transferability":"direct","body_action":"repair-candidate","body_area":"maps/handoffs","rationale":"The crosswalk spans technical and artistic occupations, making the professional boundary essential to reusable execution."}],"gaps_against_body":[{"id":"graphics-engineering-vs-art-gap","body_area":"maps/handoffs","description":"Make generated render, visual technical inspection, aesthetic/art-direction judgment and gameplay/accessibility readability separate evidence/ownership surfaces.","proposed_action":"add-handoff","priority":"high","evidence_source_ids":["onet-31.0"],"safety_or_authority_impact":false}],"contradictions":[],"nonclaims":["This packet does not claim complete reconstruction of Graphics Engineer.","Software Developer and Special Effects Artist mappings remain partial/adjacent rather than profession identity.","No aesthetic quality, gameplay readability, hardware universality, TEST, WORKING or CANON claim is created."],"high_stakes":{"is_high_stakes":false,"authorization_nonclaim":"This packet grants no art-direction, gameplay, accessibility, hardware/platform or institutional authority."}}
