{"schema_version":"0.1","profession_id":"api-platform-engineer","research_state":"BODY_REVIEWED","researched_on":"2026-09-12","body_snapshot":{"repository":"mike-axiom-mir/axm-profession-fabric","ref":"growth/research-first-cohort-31-40","path":"professions/software/api-platform-engineer/body.json","git_blob_sha":"64d71bbdc279296914b527daeead309997e47d86"},"coverage":{"occupational_baseline":true,"domain_framework":false,"observed_practice":false,"body_review":true},"source_versions":[{"source_id":"onet-31.0","version":"31.0 (August 2026)","use_mode":"adapted"}],"crosswalks":[{"source_id":"onet-31.0","external_id":"15-1252.00","label":"Software Developers","concept_type":"occupation","relation":"partial","confidence":"high","rationale":"Software Developers include interface design, systems integration and shared software solution work relevant to API/platform engineering, but the occupation is broader than this platform specialization."},{"source_id":"onet-31.0","external_id":"15-1299.08","label":"Computer Systems Engineers/Architects","concept_type":"occupation","relation":"partial","confidence":"high","rationale":"Systems Engineers/Architects contribute complex application and systems-integration work relevant to platform boundaries without defining API/platform engineering as a whole profession."}],"findings":[{"id":"api-platform-engineer-occupational-core","layer":"task","summary":"O*NET occupational evidence supports software interface, integration and reusable systems work that forms part of API/platform engineering, while no single occupation cleanly equals the AXM package boundary.","source_ids":["onet-31.0"],"method_labels":["O*NET 31.0 occupation/task baseline"],"transferability":"bounded","body_action":"covered","body_area":"scope/skills/procedures","rationale":"The body reconstructs explicit API contracts, compatibility, platform abstraction and consumer migration while retaining narrower ownership."},{"id":"api-platform-consumer-authority","layer":"handoff","summary":"Compatibility tooling can identify affected consumers and breakage surfaces but should not decide each consuming domain's semantic migration or product tradeoff.","source_ids":["onet-31.0"],"method_labels":["O*NET occupation comparison plus AXM body-boundary review"],"transferability":"bounded","body_action":"repair-candidate","body_area":"maps/handoffs","rationale":"Platform work crosses many consumers; explicit authority separation prevents shared infrastructure from becoming silent domain governance."}],"gaps_against_body":[{"id":"api-consumer-authority-gap","body_area":"maps/handoffs","description":"Add explicit rule that compatibility tooling may identify affected consumers but cannot decide a consuming domain's semantic migration for it.","proposed_action":"add-handoff","priority":"high","evidence_source_ids":["onet-31.0"],"safety_or_authority_impact":false}],"contradictions":[],"nonclaims":["This packet does not claim complete reconstruction of API / Platform Engineer.","O*NET occupation mappings are human-work evidence, not AXM profession identity or authority transfer.","No TEST, WORKING, CANON, product, security, SRE or institutional authority is created by this research packet."],"high_stakes":{"is_high_stakes":false,"authorization_nonclaim":"This research packet creates no execution, institutional, legal, safety, security, product, reliability, or certification authority."}}
