{"schema_version":"0.1","profession_id":"software-maintainer","research_state":"BODY_REVIEWED","researched_on":"2026-09-12","body_snapshot":{"repository":"mike-axiom-mir/axm-profession-fabric","ref":"growth/research-first-cohort-56-60","path":"professions/software/software-maintainer/body.json","git_blob_sha":"512f03676530b71fa30ed9f37c85e3802a24337d"},"coverage":{"occupational_baseline":true,"domain_framework":false,"observed_practice":false,"body_review":true},"source_versions":[{"source_id":"onet-31.0","version":"31.0 (August 2026)","use_mode":"adapted"}],"crosswalks":[{"source_id":"onet-31.0","external_id":"15-1252.00","label":"Software Developers","concept_type":"occupation","relation":"partial","confidence":"high","rationale":"Software Developers directly ground software maintenance, debugging and modification while the AXM package narrows the work to existing-system continuity."},{"source_id":"onet-31.0","external_id":"15-1251.00","label":"Computer Programmers","concept_type":"occupation","relation":"adjacent","confidence":"medium","rationale":"Computer Programmers ground code modification/debugging and tool use but do not define the broader compatibility/migration profession."}],"findings":[{"id":"software-maintainer-occupational-boundary","layer":"methodology","summary":"Software maintenance is not generic feature development: defect repair, dependency updates and refactoring must preserve accepted contracts or explicitly hand semantic change to owners.","source_ids":["onet-31.0"],"method_labels":["O*NET 31.0 occupational comparison"],"transferability":"bounded","body_action":"repair-candidate","body_area":"maps/evidence","rationale":"Research-first compilation makes the profession boundary explicit before use."}],"gaps_against_body":[{"id":"software-maintainer-boundary-gap","body_area":"maps/evidence","description":"Make local repair success, backward compatibility, dependency migration and product-semantic authority separate evidence surfaces.","evidence_source_ids":["onet-31.0"],"proposed_action":"add-handoff","priority":"high","safety_or_authority_impact":false}],"contradictions":[],"nonclaims":["No complete Software Maintainer reconstruction is claimed.","Occupational mappings are evidence, not profession identity.","No TEST/WORKING/CANON or adjacent authority is created."],"high_stakes":{"is_high_stakes":false,"authorization_nonclaim":"No adjacent professional, user, legal, platform or institutional authority is created."}}