{"schema_version":"0.1","profession_id":"replace-me","research_state":"BASELINED","researched_on":"YYYY-MM-DD","body_snapshot":{"repository":"owner/repo","ref":"commit-or-tag","path":"professions/domain/replace-me/body.json","git_blob_sha":"0000000000000000000000000000000000000000"},"coverage":{"occupational_baseline":false,"domain_framework":false,"observed_practice":false,"body_review":true},"source_versions":[{"source_id":"replace-source","version":"replace-version","use_mode":"referenced"}],"crosswalks":[],"findings":[{"id":"replace-finding","layer":"task","summary":"Replace with a source-grounded finding.","source_ids":["replace-source"],"method_labels":["replace-method"],"transferability":"bounded","body_action":"gap","body_area":"replace-area","rationale":"Replace with why this evidence transfers or does not."}],"gaps_against_body":[],"contradictions":[],"nonclaims":["This template grants no professional capability or maturity."],"high_stakes":{"is_high_stakes":false,"authorization_nonclaim":"No authorization or regulated-practice claim is created by this packet."}}