{"schema_version":"0.1","profession_id":"data-quality-engineer","research_state":"BODY_REVIEWED","researched_on":"2026-09-12","body_snapshot":{"repository":"mike-axiom-mir/axm-profession-fabric","ref":"growth/research-first-cohort-41-50","path":"professions/ai-data/data-quality-engineer/body.json","git_blob_sha":"6541c8699e952e77d70efe92ebddd209ffc26d9b"},"coverage":{"occupational_baseline":true,"domain_framework":false,"observed_practice":false,"body_review":true},"source_versions":[{"source_id":"onet-31.0","version":"31.0 (August 2026)","use_mode":"adapted"}],"crosswalks":[{"source_id":"onet-31.0","external_id":"15-1243.01","label":"Data Warehousing Specialists","concept_type":"occupation","relation":"partial","confidence":"high","rationale":"Data warehousing work includes data validation, ETL mapping and data-quality responsibilities but also broader warehouse architecture."},{"source_id":"onet-31.0","external_id":"15-1253.00","label":"Software Quality Assurance Analysts and Testers","concept_type":"occupation","relation":"adjacent","confidence":"medium","rationale":"QA contributes validation/failure discipline while data semantics and lineage are distinct."}],"findings":[{"id":"data-quality-engineer-occupational-boundary","layer":"methodology","summary":"Data-quality engineering combines warehouse/data validation work with QA-style evidence discipline; structural, semantic and repair authority must remain separate.","source_ids":["onet-31.0"],"method_labels":["O*NET 31.0 occupational comparison"],"transferability":"bounded","body_action":"repair-candidate","body_area":"maps/evidence","rationale":"Research-first compilation makes the specialization boundary explicit before use."}],"gaps_against_body":[{"id":"data-quality-engineer-boundary-gap","body_area":"maps/evidence","description":"Make structural checks, semantic validity and data-repair authority separate evidence surfaces.","evidence_source_ids":["onet-31.0"],"proposed_action":"add-handoff","priority":"high","safety_or_authority_impact":false}],"contradictions":[],"nonclaims":["No complete Data Quality Engineer reconstruction is claimed.","Occupational mappings are evidence, not profession identity.","No TEST/WORKING/CANON or adjacent authority is created."],"high_stakes":{"is_high_stakes":false,"authorization_nonclaim":"No adjacent professional, platform, security, product or institutional authority is created."}}