{"schema_version":"0.1","profession_id":"project-manager","research_state":"BODY_REVIEWED","researched_on":"2026-09-12","body_snapshot":{"repository":"mike-axiom-mir/axm-profession-fabric","ref":"growth/operations-cohort-79-89","path":"professions/operations/project-manager/body.json","git_blob_sha":"6bbb565f52325a8f905bcdc84db279d25a3fbd1b"},"coverage":{"occupational_baseline":true,"domain_framework":false,"observed_practice":false,"body_review":true},"source_versions":[{"source_id":"onet-31.0","version":"31.0 (August 2026)","use_mode":"adapted"}],"crosswalks":[{"source_id":"onet-31.0","external_id":"13-1082.00","label":"Project Management Specialists","concept_type":"occupation","relation":"exact","confidence":"high","rationale":"Project Management Specialists is a bounded occupational baseline for Project Manager; AXM profession identity/authority/maturity remain separate."}],"findings":[{"id":"project-manager-occupational-boundary","layer":"methodology","summary":"Project Management must keep coordination, schedule and delivery status separate from specialist acceptance, product authority and constitutional merge authority.","source_ids":["onet-31.0"],"method_labels":["O*NET 31.0 occupational comparison"],"transferability":"bounded","body_action":"repair-candidate","body_area":"maps/evidence","rationale":"Research-first compilation makes the boundary explicit before use."}],"gaps_against_body":[{"id":"project-manager-boundary-gap","body_area":"maps/evidence","description":"Make delivery-status-versus-technical-acceptance, scope-drift and authority boundaries explicit.","evidence_source_ids":["onet-31.0"],"proposed_action":"add-handoff","priority":"high","safety_or_authority_impact":true}],"contradictions":[],"nonclaims":["No complete Project Manager reconstruction is claimed.","No TEST/WORKING/CANON or adjacent institutional authority is created."],"high_stakes":{"is_high_stakes":false,"authorization_nonclaim":"No role label, package, model capability, repository permission or coordination function creates constitutional, product, professional or institutional authority."}}