{"schema_version":"0.1","profession_id":"procurement-specialist","research_state":"BODY_REVIEWED","researched_on":"2026-09-12","body_snapshot":{"repository":"mike-axiom-mir/axm-profession-fabric","ref":"growth/operations-cohort-79-89","path":"professions/operations/procurement-specialist/body.json","git_blob_sha":"ce9b61cf5c78fef7d64bbceafab81046b8f7390f"},"coverage":{"occupational_baseline":true,"domain_framework":false,"observed_practice":false,"body_review":true},"source_versions":[{"source_id":"onet-31.0","version":"31.0 (August 2026)","use_mode":"adapted"}],"crosswalks":[{"source_id":"onet-31.0","external_id":"13-1023.00","label":"Purchasing Agents, Except Wholesale, Retail, and Farm Products","concept_type":"occupation","relation":"partial","confidence":"high","rationale":"Purchasing Agents, Except Wholesale, Retail, and Farm Products is a bounded occupational baseline for Procurement Specialist; AXM profession identity/authority/maturity remain separate."}],"findings":[{"id":"procurement-specialist-occupational-boundary","layer":"methodology","summary":"Procurement must keep commercial sourcing/execution separate from technical, security, legal, privacy and financial acceptance.","source_ids":["onet-31.0"],"method_labels":["O*NET 31.0 occupational comparison"],"transferability":"bounded","body_action":"repair-candidate","body_area":"maps/evidence","rationale":"Research-first compilation makes the boundary explicit before use."}],"gaps_against_body":[{"id":"procurement-specialist-boundary-gap","body_area":"maps/evidence","description":"Make price/availability-versus-suitability, vendor-claim-versus-evidence and hidden-criteria boundaries explicit.","evidence_source_ids":["onet-31.0"],"proposed_action":"add-handoff","priority":"high","safety_or_authority_impact":true}],"contradictions":[],"nonclaims":["No complete Procurement Specialist reconstruction is claimed.","No TEST/WORKING/CANON or adjacent institutional authority is created."],"high_stakes":{"is_high_stakes":false,"authorization_nonclaim":"No role label, package, model capability, repository permission or coordination function creates constitutional, product, professional or institutional authority."}}