{"schema_version":"0.1","profession_id":"cinematographer","research_state":"BODY_REVIEWED","researched_on":"2026-09-12","body_snapshot":{"repository":"mike-axiom-mir/axm-profession-fabric","ref":"growth/creation-cohort-90-100","path":"professions/creative-media/cinematographer/body.json","git_blob_sha":"4525ae3290b7746b5683dc3721a2cc7c51a1347b"},"coverage":{"occupational_baseline":true,"domain_framework":false,"observed_practice":false,"body_review":true},"source_versions":[{"source_id":"onet-31.0","version":"31.0 (August 2026)","use_mode":"adapted"}],"crosswalks":[{"source_id":"onet-31.0","external_id":"27-4031.00","label":"Camera Operators, Television, Video, and Film","concept_type":"occupation","relation":"partial","confidence":"high","rationale":"Camera Operators, Television, Video, and Film provides bounded occupational evidence adjacent to Cinematographer; AXM keeps the profession contract narrower and evidence-bound."}],"findings":[{"id":"cinematographer-occupational-boundary","layer":"methodology","summary":"Cinematographer must keep craft/technical outputs, target-context evidence and adjacent professional acceptance as separate evidence surfaces.","source_ids":["onet-31.0"],"method_labels":["O*NET 31.0 occupational comparison"],"transferability":"bounded","body_action":"repair-candidate","body_area":"maps/evidence","rationale":"Research-first compilation makes the profession boundary explicit before use."}],"gaps_against_body":[{"id":"cinematographer-boundary-gap","body_area":"maps/evidence","description":"Make source identity, target-context evidence, craft/technical output and adjacent acceptance explicit and non-interchangeable.","evidence_source_ids":["onet-31.0"],"proposed_action":"add-handoff","priority":"high","safety_or_authority_impact":false}],"contradictions":[],"nonclaims":["No complete Cinematographer reconstruction is claimed.","Occupational mappings are evidence, not profession identity.","No TEST/WORKING/CANON or adjacent authority is created."],"high_stakes":{"is_high_stakes":false,"authorization_nonclaim":"No adjacent professional, user, legal, platform or institutional authority is created."}}