{"schema_version":"0.1","profession_id":"build-engineer","research_state":"BODY_REVIEWED","researched_on":"2026-09-12","body_snapshot":{"repository":"mike-axiom-mir/axm-profession-fabric","ref":"growth/research-first-cohort-51-55","path":"professions/software/build-engineer/body.json","git_blob_sha":"5613c782e75e940e9eca3d25f99c07c33a6012f0"},"coverage":{"occupational_baseline":true,"domain_framework":false,"observed_practice":false,"body_review":true},"source_versions":[{"source_id":"onet-31.0","version":"31.0 (August 2026)","use_mode":"adapted"}],"crosswalks":[{"source_id":"onet-31.0","external_id":"15-1252.00","label":"Software Developers","concept_type":"occupation","relation":"partial","confidence":"high","rationale":"Software Developers ground software/toolchain work while Build Engineering specializes artifact production and reproducibility."},{"source_id":"onet-31.0","external_id":"15-1251.00","label":"Computer Programmers","concept_type":"occupation","relation":"adjacent","confidence":"medium","rationale":"Programming/debugging/tool-use work provides adjacent build/toolchain evidence without defining modern build engineering."}],"findings":[{"id":"build-engineer-occupational-boundary","layer":"methodology","summary":"Build Engineering is a tooling/reproducibility specialization whose output must remain subordinate to consuming runtime/integration/release evidence.","source_ids":["onet-31.0"],"method_labels":["O*NET 31.0 occupational comparison"],"transferability":"bounded","body_action":"repair-candidate","body_area":"maps/evidence","rationale":"Research-first compilation makes the profession boundary explicit before use."}],"gaps_against_body":[{"id":"build-engineer-boundary-gap","body_area":"maps/evidence","description":"Make build success, artifact identity/cache validity and consuming-runtime/release acceptance separate evidence surfaces.","evidence_source_ids":["onet-31.0"],"proposed_action":"add-handoff","priority":"high","safety_or_authority_impact":false}],"contradictions":[],"nonclaims":["No complete Build Engineer reconstruction is claimed.","Occupational mappings are evidence, not profession identity.","No TEST/WORKING/CANON or adjacent authority is created."],"high_stakes":{"is_high_stakes":false,"authorization_nonclaim":"No adjacent professional, user, legal, platform or institutional authority is created."}}