{"schema_version":"0.1","profession_id":"vendor-management-specialist","research_state":"BODY_REVIEWED","researched_on":"2026-09-12","body_snapshot":{"repository":"mike-axiom-mir/axm-profession-fabric","ref":"growth/operations-cohort-79-89","path":"professions/operations/vendor-management-specialist/body.json","git_blob_sha":"fadc49c800cfc994e9b41eba8f12aa00cc7858e7"},"coverage":{"occupational_baseline":true,"domain_framework":false,"observed_practice":false,"body_review":true},"source_versions":[{"source_id":"onet-31.0","version":"31.0 (August 2026)","use_mode":"adapted"}],"crosswalks":[{"source_id":"onet-31.0","external_id":"11-3061.00","label":"Purchasing Managers","concept_type":"occupation","relation":"partial","confidence":"medium","rationale":"Purchasing Managers is a bounded occupational baseline for Vendor Management Specialist; AXM profession identity/authority/maturity remain separate."}],"findings":[{"id":"vendor-management-specialist-occupational-boundary","layer":"methodology","summary":"Vendor Management must keep relationship/performance coordination separate from specialist acceptance and make dependency/exit risk explicit.","source_ids":["onet-31.0"],"method_labels":["O*NET 31.0 occupational comparison"],"transferability":"bounded","body_action":"repair-candidate","body_area":"maps/evidence","rationale":"Research-first compilation makes the boundary explicit before use."}],"gaps_against_body":[{"id":"vendor-management-specialist-boundary-gap","body_area":"maps/evidence","description":"Make vendor-score-versus-specialist-acceptance, relationship-trust and lock-in continuity boundaries explicit.","evidence_source_ids":["onet-31.0"],"proposed_action":"add-handoff","priority":"high","safety_or_authority_impact":true}],"contradictions":[],"nonclaims":["No complete Vendor Management Specialist reconstruction is claimed.","No TEST/WORKING/CANON or adjacent institutional authority is created."],"high_stakes":{"is_high_stakes":false,"authorization_nonclaim":"No role label, package, model capability, repository permission or coordination function creates constitutional, product, professional or institutional authority."}}