{"schema_version":"0.1","profession_id":"desktop-application-engineer","research_state":"BODY_REVIEWED","researched_on":"2026-09-12","body_snapshot":{"repository":"mike-axiom-mir/axm-profession-fabric","ref":"growth/research-first-cohort-41-50","path":"professions/software/desktop-application-engineer/body.json","git_blob_sha":"78e75c07a4a0852d7c1719c103e7cda5c4de3c6e"},"coverage":{"occupational_baseline":true,"domain_framework":false,"observed_practice":false,"body_review":true},"source_versions":[{"source_id":"onet-31.0","version":"31.0 (August 2026)","use_mode":"adapted"}],"crosswalks":[{"source_id":"onet-31.0","external_id":"15-1252.00","label":"Software Developers","concept_type":"occupation","relation":"partial","confidence":"high","rationale":"Broad software occupation includes application development but not a dedicated desktop-runtime boundary."}],"findings":[{"id":"desktop-application-engineer-occupational-boundary","layer":"methodology","summary":"Desktop application work is a bounded specialization of broad software development where OS/runtime, packaging and local-state transitions become first-class evidence.","source_ids":["onet-31.0"],"method_labels":["O*NET 31.0 occupational comparison"],"transferability":"bounded","body_action":"repair-candidate","body_area":"scope/maps/evidence","rationale":"Research-first compilation makes the specialization boundary explicit before use."}],"gaps_against_body":[{"id":"desktop-application-engineer-boundary-gap","body_area":"maps/evidence","description":"Make one-platform success, packaging success and actual cross-platform/update continuity separate evidence surfaces.","evidence_source_ids":["onet-31.0"],"proposed_action":"add-handoff","priority":"high","safety_or_authority_impact":false}],"contradictions":[],"nonclaims":["No complete Desktop Application Engineer reconstruction is claimed.","Occupational mappings are evidence, not profession identity.","No TEST/WORKING/CANON or adjacent authority is created."],"high_stakes":{"is_high_stakes":false,"authorization_nonclaim":"No adjacent professional, platform, security, product or institutional authority is created."}}