{"schema_version":"0.1","profession_id":"data-platform-engineer","research_state":"BODY_REVIEWED","researched_on":"2026-09-12","body_snapshot":{"repository":"mike-axiom-mir/axm-profession-fabric","ref":"growth/research-first-cohort-31-40","path":"professions/software/data-platform-engineer/body.json","git_blob_sha":"f99af8fd847e0c806c3dbe60a74e0f635b8b6c9f"},"coverage":{"occupational_baseline":true,"domain_framework":false,"observed_practice":false,"body_review":true},"source_versions":[{"source_id":"onet-31.0","version":"31.0 (August 2026)","use_mode":"adapted"}],"crosswalks":[{"source_id":"onet-31.0","external_id":"15-1243.00","label":"Database Architects","concept_type":"occupation","relation":"partial","confidence":"high","rationale":"Database Architects explicitly cover data warehouse systems, data models, workflow integration, performance and standards; data-platform engineering extends this into reusable pipeline/platform runtime machinery."},{"source_id":"onet-31.0","external_id":"15-1252.00","label":"Software Developers","concept_type":"occupation","relation":"broader","confidence":"medium","rationale":"Software Developers provide broader distributed software/integration evidence around the platform implementation layer."}],"findings":[{"id":"data-platform-engineer-occupational-core","layer":"task","summary":"O*NET occupational evidence provides a human-work baseline for the core tasks adjacent to Data Platform Engineer; AXM keeps the mapping bounded instead of treating the occupation code as profession identity.","source_ids":["onet-31.0"],"method_labels":["O*NET 31.0 occupation/task baseline"],"transferability":"bounded","body_action":"covered","body_area":"scope/skills/procedures","rationale":"The candidate body includes the grounded core while preserving narrower AXM ownership boundaries."},{"id":"data-platform-engineer-boundary-finding","layer":"handoff","summary":"Keep platform contracts separate from metric/domain semantics and require explicit domain ownership when structurally compatible data changes meaning.","source_ids":["onet-31.0"],"method_labels":["O*NET occupation comparison plus AXM body-boundary review"],"transferability":"bounded","body_action":"repair-candidate","body_area":"maps/handoffs","rationale":"The external occupation is broader or differently bundled, so explicit separation is required before reusable package composition."}],"gaps_against_body":[{"id":"data-platform-semantic-boundary-gap","body_area":"maps/handoffs","description":"Keep platform contracts separate from metric/domain semantics and require explicit domain ownership when structurally compatible data changes meaning.","proposed_action":"add-handoff","priority":"high","evidence_source_ids":["onet-31.0"],"safety_or_authority_impact":false}],"contradictions":[],"nonclaims":["This packet does not claim complete reconstruction of Data Platform Engineer.","The O*NET occupation mapping is evidence for human work structure, not AXM profession identity or automatic scope transfer.","No TEST, WORKING, CANON, product, security, safety, legal or institutional authority is created by this research packet."],"high_stakes":{"is_high_stakes":false,"authorization_nonclaim":"This research packet creates no execution, institutional, legal, safety, security, product, or certification authority."}}
