{"schema_version":"0.1","profession_id":"developer-tools-engineer","research_state":"BODY_REVIEWED","researched_on":"2026-09-12","body_snapshot":{"repository":"mike-axiom-mir/axm-profession-fabric","ref":"growth/research-first-cohort-36-40","path":"professions/software/developer-tools-engineer/body.json","git_blob_sha":"053b3cb0ed67d50fa7195231b8159fdd69308456"},"coverage":{"occupational_baseline":true,"domain_framework":false,"observed_practice":false,"body_review":true},"source_versions":[{"source_id":"onet-31.0","version":"31.0 (August 2026)","use_mode":"adapted"}],"crosswalks":[{"source_id":"onet-31.0","external_id":"15-1252.00","label":"Software Developers","concept_type":"occupation","relation":"partial","confidence":"high","rationale":"Software Developers ground implementation, tooling and integration work, but developer-tool engineering is a specialization around tools used by other developers rather than application/product software broadly."},{"source_id":"onet-31.0","external_id":"15-1251.00","label":"Computer Programmers","concept_type":"occupation","relation":"adjacent","confidence":"medium","rationale":"Computer Programmers contribute debugging, testing and code/tool interaction evidence relevant to developer workflows while remaining a different occupation boundary."}],"findings":[{"id":"developer-tools-engineer-occupational-core","layer":"task","summary":"O*NET software/programming evidence supports tool-building, debugging, testing and code-oriented workflows while no exact occupation isolates the developer-tools specialization.","source_ids":["onet-31.0"],"method_labels":["O*NET 31.0 Software Developer and Computer Programmer occupational comparison"],"transferability":"bounded","body_action":"covered","body_area":"scope/skills/procedures","rationale":"The candidate body narrows the broad software baseline into tooling contracts, diagnostics, transformations and provenance."},{"id":"developer-tools-output-authority","layer":"handoff","summary":"Developer-tool output can expose evidence and automate transformations but cannot become correctness authority for the professions that consume it.","source_ids":["onet-31.0"],"method_labels":["Occupational workflow comparison plus AXM tool/authority review"],"transferability":"direct","body_action":"repair-candidate","body_area":"maps/handoffs","rationale":"A reusable tool layer becomes dangerous if its convenience silently replaces the professional judgment it was built to support."}],"gaps_against_body":[{"id":"devtools-tool-result-authority-gap","body_area":"maps/handoffs","description":"Make tool-output authority explicit: tools may transform, test, generate and diagnose, but their outputs cannot silently become target-profession correctness or shared-state authority.","proposed_action":"add-handoff","priority":"high","evidence_source_ids":["onet-31.0"],"safety_or_authority_impact":false}],"contradictions":[],"nonclaims":["This packet does not claim complete reconstruction of Developer Tools Engineer.","Software Developer and Computer Programmer mappings remain partial/adjacent rather than AXM profession identity.","No target-software correctness, TEST, WORKING, CANON or consuming-profession authority is created."],"high_stakes":{"is_high_stakes":false,"authorization_nonclaim":"This packet grants no target-profession, security, operations, shared-state or institutional authority."}}
