{"schema_version":"0.1","profession_id":"accessibility-engineer","research_state":"BODY_REVIEWED","researched_on":"2026-09-12","body_snapshot":{"repository":"mike-axiom-mir/axm-profession-fabric","ref":"growth/research-first-cohort-51-55","path":"professions/software/accessibility-engineer/body.json","git_blob_sha":"096c73e0e548ae06a52aabd9e5f3ef8694f5dc60"},"coverage":{"occupational_baseline":true,"domain_framework":false,"observed_practice":false,"body_review":true},"source_versions":[{"source_id":"onet-31.0","version":"31.0 (August 2026)","use_mode":"adapted"}],"crosswalks":[{"source_id":"onet-31.0","external_id":"15-1255.00","label":"Web and Digital Interface Designers","concept_type":"occupation","relation":"partial","confidence":"high","rationale":"Web and Digital Interface Designers explicitly include accessibility/usability concerns but also broader design work outside software-accessibility engineering."},{"source_id":"onet-31.0","external_id":"15-1252.00","label":"Software Developers","concept_type":"occupation","relation":"adjacent","confidence":"high","rationale":"Software Developers ground implementation/runtime behavior while accessibility requirement interpretation and lived-user evidence remain separate."}],"findings":[{"id":"accessibility-engineer-occupational-boundary","layer":"methodology","summary":"Accessibility engineering combines interface implementation with specialized evidence boundaries; automated semantics and synthetic input must not be collapsed into conformance or lived-user success.","source_ids":["onet-31.0"],"method_labels":["O*NET 31.0 occupational comparison"],"transferability":"bounded","body_action":"repair-candidate","body_area":"maps/evidence","rationale":"Research-first compilation makes the profession boundary explicit before use."}],"gaps_against_body":[{"id":"accessibility-engineer-boundary-gap","body_area":"maps/evidence","description":"Make automation/tree evidence, synthetic interaction, human/AT experience and legal/full-conformance authority separate surfaces.","evidence_source_ids":["onet-31.0"],"proposed_action":"add-handoff","priority":"high","safety_or_authority_impact":false}],"contradictions":[],"nonclaims":["No complete Software Accessibility Engineer reconstruction is claimed.","Occupational mappings are evidence, not profession identity.","No TEST/WORKING/CANON or adjacent authority is created."],"high_stakes":{"is_high_stakes":false,"authorization_nonclaim":"No adjacent professional, user, legal, platform or institutional authority is created."}}