{"schema_version":"0.1","profession_id":"digital-forensics-specialist","research_state":"BODY_REVIEWED","researched_on":"2026-09-12","body_snapshot":{"repository":"mike-axiom-mir/axm-profession-fabric","ref":"growth/security-cohort-71-78","path":"professions/security-privacy/digital-forensics-specialist/body.json","git_blob_sha":"00dec2c576cf3a1d1f67af363356f273fa771a75"},"coverage":{"occupational_baseline":true,"domain_framework":true,"observed_practice":false,"body_review":true},"source_versions":[{"source_id":"onet-31.0","version":"31.0 (August 2026)","use_mode":"adapted"},{"source_id":"nist-nice-2.2.0","version":"2.2.0 (28 Apr 2026)","use_mode":"adapted"}],"crosswalks":[{"source_id":"onet-31.0","external_id":"15-1299.06","label":"Digital Forensics Analysts","concept_type":"occupation","relation":"exact","confidence":"high","rationale":"O*NET 31.0 directly covers preservation, analysis and presentation of computer-related digital evidence."},{"source_id":"nist-nice-2.2.0","external_id":"IN-WRL-001","label":"Cybercrime Investigation","concept_type":"work-role","relation":"partial","confidence":"high","rationale":"NICE v2.1+ comprehensively revised Cybercrime Investigation task/knowledge/skill alignments; legal/investigative authority remains separate from AXM technical forensics."}],"findings":[{"id":"digital-forensics-specialist-occupational-boundary","layer":"methodology","summary":"Digital Forensics must preserve evidence identity and reproducibility while keeping technical observation separate from legal admissibility, attribution and incident-command authority.","source_ids":["onet-31.0","nist-nice-2.2.0"],"method_labels":["O*NET 31.0 occupational comparison","NICE Framework Components v2.2.0 crosswalk"],"transferability":"bounded","body_action":"repair-candidate","body_area":"maps/evidence","rationale":"Research-backed boundary is compiled into package-local machinery."}],"gaps_against_body":[{"id":"digital-forensics-specialist-boundary-gap","body_area":"maps/evidence","description":"Make source-versus-derived evidence, custody integrity and observation-versus-attribution boundaries explicit.","evidence_source_ids":["onet-31.0","nist-nice-2.2.0"],"proposed_action":"add-handoff","priority":"high","safety_or_authority_impact":true}],"contradictions":[],"nonclaims":["No complete Digital Forensics Specialist reconstruction is claimed.","No TEST/WORKING/CANON or adjacent authority is created."],"high_stakes":{"is_high_stakes":true,"authorization_nonclaim":"No technical access, package construction, role label, model capability or repository permission creates legal, security, safety, privacy, risk, product or institutional authority."}}