{"schema_version":"0.1","profession_id":"mobile-application-engineer","research_state":"BODY_REVIEWED","researched_on":"2026-09-12","body_snapshot":{"repository":"mike-axiom-mir/axm-profession-fabric","ref":"growth/research-first-cohort-36-40","path":"professions/software/mobile-application-engineer/body.json","git_blob_sha":"142337348a104583a18d78ad75528b5bd9f477d7"},"coverage":{"occupational_baseline":true,"domain_framework":false,"observed_practice":false,"body_review":true},"source_versions":[{"source_id":"onet-31.0","version":"31.0 (August 2026)","use_mode":"adapted"}],"crosswalks":[{"source_id":"onet-31.0","external_id":"15-1252.00","label":"Software Developers","concept_type":"occupation","relation":"partial","confidence":"high","rationale":"Software Developers include application design, integration, performance and hardware/software interaction relevant to mobile engineering, but do not isolate mobile OS lifecycle, device variation or emulator-versus-device evidence."}],"findings":[{"id":"mobile-application-engineer-occupational-core","layer":"task","summary":"O*NET Software Developer work provides a broad human-work baseline for mobile application implementation, integration and performance while the AXM package narrows it around mobile lifecycle/device/runtime constraints.","source_ids":["onet-31.0"],"method_labels":["O*NET 31.0 Software Developer occupation/task baseline"],"transferability":"bounded","body_action":"covered","body_area":"scope/skills/procedures","rationale":"The candidate body explicitly reconstructs mobile lifecycle, device variation, local/offline state and packaging/update machinery."},{"id":"mobile-device-evidence-separation","layer":"work-context","summary":"Mobile engineering needs an explicit emulator/simulator/physical-device evidence boundary because broad software occupational evidence does not make device/runtime parity claims safe by default.","source_ids":["onet-31.0"],"method_labels":["O*NET occupational baseline plus AXM runtime-evidence review"],"transferability":"bounded","body_action":"repair-candidate","body_area":"maps/handoffs","rationale":"The reusable package must preserve execution-surface identity so one emulator/device result cannot silently become universal mobile correctness."}],"gaps_against_body":[{"id":"mobile-device-evidence-gap","body_area":"maps/handoffs","description":"Make emulator, simulator, physical-device and OS-version evidence surfaces explicit and require narrower claims or additional evidence before device/platform parity assertions.","proposed_action":"add-handoff","priority":"high","evidence_source_ids":["onet-31.0"],"safety_or_authority_impact":false}],"contradictions":[],"nonclaims":["This packet does not claim complete reconstruction of Mobile Application Engineer.","The Software Developer occupation mapping remains partial rather than AXM profession identity.","No device parity, privacy, security, accessibility, platform-policy, TEST, WORKING or CANON claim is created."],"high_stakes":{"is_high_stakes":false,"authorization_nonclaim":"This packet grants no platform, privacy, security, product, device, accessibility or institutional authority."}}
