{"schema_version":"0.1","profession_id":"interaction-designer","research_state":"BODY_REVIEWED","researched_on":"2026-09-12","body_snapshot":{"repository":"mike-axiom-mir/axm-profession-fabric","ref":"growth/adjacent-software-cohort-65-70","path":"professions/product-design/interaction-designer/body.json","git_blob_sha":"10f1fb6f3c6a692250b1c9de8fb2a7da4a1af0bc"},"coverage":{"occupational_baseline":true,"domain_framework":false,"observed_practice":false,"body_review":true},"source_versions":[{"source_id":"onet-31.0","version":"31.0 (August 2026)","use_mode":"adapted"}],"crosswalks":[{"source_id":"onet-31.0","external_id":"15-1255.00","label":"Web and Digital Interface Designers","concept_type":"occupation","relation":"partial","confidence":"high","rationale":"Interface design grounds interaction and usability work while AXM isolates behavior contracts from adjacent authority."}],"findings":[{"id":"interaction-designer-occupational-boundary","layer":"methodology","summary":"Interaction design is strongest when flows, states, feedback and recovery are explicit while prototype behavior remains separate from representative-user, accessibility and runtime evidence.","source_ids":["onet-31.0"],"method_labels":["O*NET 31.0 occupational comparison"],"transferability":"bounded","body_action":"repair-candidate","body_area":"maps/evidence","rationale":"Research-first compilation makes the specialist boundary explicit before use."}],"gaps_against_body":[{"id":"interaction-designer-boundary-gap","body_area":"maps/evidence","description":"Make prototype-versus-user-evidence and happy-path-versus-recovery boundaries explicit before using interaction specifications.","evidence_source_ids":["onet-31.0"],"proposed_action":"add-handoff","priority":"high","safety_or_authority_impact":false}],"contradictions":[],"nonclaims":["No complete Interaction Designer reconstruction is claimed.","Occupational mappings are evidence, not profession identity.","No TEST/WORKING/CANON or adjacent authority is created."],"high_stakes":{"is_high_stakes":false,"authorization_nonclaim":"No adjacent professional, user, legal, platform or institutional authority is created."}}