{"schema_version":"0.1","profession_id":"embedded-software-engineer","research_state":"BODY_REVIEWED","researched_on":"2026-09-12","body_snapshot":{"repository":"mike-axiom-mir/axm-profession-fabric","ref":"growth/research-first-cohort-31-40","path":"professions/software/embedded-software-engineer/body.json","git_blob_sha":"c34572b080b4cc41a7803e397ce5fafd14274152"},"coverage":{"occupational_baseline":true,"domain_framework":false,"observed_practice":false,"body_review":true},"source_versions":[{"source_id":"onet-31.0","version":"31.0 (August 2026)","use_mode":"adapted"}],"crosswalks":[{"source_id":"onet-31.0","external_id":"15-1252.00","label":"Software Developers","concept_type":"occupation","relation":"partial","confidence":"high","rationale":"Software Developers cover implementation and hardware/software integration relevant to firmware/device software but do not isolate embedded target, revision or physical-evidence boundaries."},{"source_id":"onet-31.0","external_id":"17-2061.00","label":"Computer Hardware Engineers","concept_type":"occupation","relation":"adjacent","confidence":"high","rationale":"Computer Hardware Engineers explicitly evaluate hardware/software interfaces and physical hardware design/test, supplying the adjacent ownership boundary rather than an embedded-software identity."}],"findings":[{"id":"embedded-software-engineer-occupational-core","layer":"task","summary":"O*NET software and hardware occupational evidence jointly grounds the hardware/software interface work around embedded software while showing that the work crosses two profession families rather than one exact occupation.","source_ids":["onet-31.0"],"method_labels":["O*NET 31.0 Software Developer and Computer Hardware Engineer occupation/task baselines"],"transferability":"bounded","body_action":"covered","body_area":"scope/skills/procedures","rationale":"The candidate body narrows the overlap into firmware, target constraints, hardware-interface implementation and recovery while preserving physical/hardware ownership."},{"id":"embedded-evidence-surface-separation","layer":"handoff","summary":"Simulation, target execution, document applicability and physical observation are distinct evidence surfaces; software machinery must not infer physical or safety behavior from simulator-only proof.","source_ids":["onet-31.0"],"method_labels":["Cross-occupation hardware/software boundary review"],"transferability":"direct","body_action":"repair-candidate","body_area":"maps/handoffs","rationale":"Hardware/software occupational overlap makes the evidence boundary a first-class contract for a reusable embedded package."}],"gaps_against_body":[{"id":"embedded-physical-evidence-gap","body_area":"maps/handoffs","description":"Make simulator/target/document/physical-observation evidence surfaces explicit and require hardware/safety ownership for claims that cross software-only observability.","proposed_action":"add-handoff","priority":"high","evidence_source_ids":["onet-31.0"],"safety_or_authority_impact":false}],"contradictions":[],"nonclaims":["This packet does not claim complete reconstruction of Embedded Software Engineer.","Software Developer and Computer Hardware Engineer mappings remain partial/adjacent rather than AXM profession identity.","No physical-device correctness, electrical, safety, manufacturing, TEST, WORKING or CANON claim is created by this research packet."],"high_stakes":{"is_high_stakes":false,"authorization_nonclaim":"This packet grants no hardware, electrical, safety, manufacturing, physical-device deployment or institutional authority."}}
