{"schema_version":"0.1","profession_id":"penetration-tester","research_state":"BODY_REVIEWED","researched_on":"2026-09-12","body_snapshot":{"repository":"mike-axiom-mir/axm-profession-fabric","ref":"growth/security-cohort-71-78","path":"professions/security-privacy/penetration-tester/body.json","git_blob_sha":"68c507ad4050d9de68fdf99c56920c06cca4e309"},"coverage":{"occupational_baseline":true,"domain_framework":true,"observed_practice":false,"body_review":true},"source_versions":[{"source_id":"onet-31.0","version":"31.0 (August 2026)","use_mode":"adapted"},{"source_id":"nist-nice-2.2.0","version":"2.2.0 (28 Apr 2026)","use_mode":"adapted"}],"crosswalks":[{"source_id":"onet-31.0","external_id":"15-1299.04","label":"Penetration Testers","concept_type":"occupation","relation":"exact","confidence":"high","rationale":"O*NET 31.0 directly defines Penetration Testers as conducting simulated cyberattacks to assess system security."},{"source_id":"nist-nice-2.2.0","external_id":"PD-WRL-005","label":"Vulnerability Analysis","concept_type":"work-role","relation":"adjacent","confidence":"medium","rationale":"NICE vulnerability-analysis work provides task/knowledge/skill context; explicit penetration-test authorization remains separate."}],"findings":[{"id":"penetration-tester-occupational-boundary","layer":"methodology","summary":"Penetration Testing requires exact authorization/scope and must separate observed exploitability from global security claims, data access from consent, and findings from risk acceptance.","source_ids":["onet-31.0","nist-nice-2.2.0"],"method_labels":["O*NET 31.0 occupational comparison","NICE Framework Components v2.2.0 crosswalk"],"transferability":"bounded","body_action":"repair-candidate","body_area":"maps/evidence","rationale":"Research-backed boundary is compiled into package-local machinery."}],"gaps_against_body":[{"id":"penetration-tester-boundary-gap","body_area":"maps/evidence","description":"Make authorization, safety-stop, sensitive-data and negative-result truth boundaries explicit.","evidence_source_ids":["onet-31.0","nist-nice-2.2.0"],"proposed_action":"add-handoff","priority":"high","safety_or_authority_impact":true}],"contradictions":[],"nonclaims":["No complete Penetration Tester reconstruction is claimed.","No TEST/WORKING/CANON or adjacent authority is created."],"high_stakes":{"is_high_stakes":true,"authorization_nonclaim":"No technical access, package construction, role label, model capability or repository permission creates legal, security, safety, privacy, risk, product or institutional authority."}}