{"schema_version":"0.1","profession_id":"cloud-security-engineer","research_state":"BODY_REVIEWED","researched_on":"2026-09-12","body_snapshot":{"repository":"mike-axiom-mir/axm-profession-fabric","ref":"growth/security-cohort-71-78","path":"professions/security-privacy/cloud-security-engineer/body.json","git_blob_sha":"60c323beb9dc5595d1db4bfe994e2b6a63f1f5ae"},"coverage":{"occupational_baseline":true,"domain_framework":true,"observed_practice":false,"body_review":true},"source_versions":[{"source_id":"onet-31.0","version":"31.0 (August 2026)","use_mode":"adapted"},{"source_id":"nist-nice-2.2.0","version":"2.2.0 (28 Apr 2026)","use_mode":"adapted"}],"crosswalks":[{"source_id":"onet-31.0","external_id":"15-1212.00","label":"Information Security Analysts","concept_type":"occupation","relation":"partial","confidence":"high","rationale":"Information security analysis grounds protective control and monitoring work adjacent to cloud-security specialization."},{"source_id":"nist-nice-2.2.0","external_id":"NF-COM-004","label":"Cloud Security","concept_type":"competency-area","relation":"partial","confidence":"high","rationale":"NICE v2.2.0 includes Cloud Security as a current cybersecurity competency area; competency coverage is not profession identity or authorization."}],"findings":[{"id":"cloud-security-engineer-occupational-boundary","layer":"methodology","summary":"Cloud Security Engineering must bind security claims to exact cloud resource/provider responsibility and keep configuration evidence separate from application security, privacy, incident response and risk acceptance.","source_ids":["onet-31.0","nist-nice-2.2.0"],"method_labels":["O*NET 31.0 occupational comparison","NICE Framework Components v2.2.0 crosswalk"],"transferability":"bounded","body_action":"repair-candidate","body_area":"maps/evidence","rationale":"Research-backed boundary is compiled into package-local machinery."}],"gaps_against_body":[{"id":"cloud-security-engineer-boundary-gap","body_area":"maps/evidence","description":"Make provider/workload responsibility, cloud-identity drift and posture-scan truth boundaries explicit.","evidence_source_ids":["onet-31.0","nist-nice-2.2.0"],"proposed_action":"add-handoff","priority":"high","safety_or_authority_impact":true}],"contradictions":[],"nonclaims":["No complete Cloud Security Engineer reconstruction is claimed.","No TEST/WORKING/CANON or adjacent authority is created."],"high_stakes":{"is_high_stakes":true,"authorization_nonclaim":"No technical access, package construction, role label, model capability or repository permission creates legal, security, safety, privacy, risk, product or institutional authority."}}