{"schema_version":"0.1","profession_id":"risk-manager","research_state":"BODY_REVIEWED","researched_on":"2026-09-12","body_snapshot":{"repository":"mike-axiom-mir/axm-profession-fabric","ref":"growth/operations-cohort-79-89","path":"professions/operations/risk-manager/body.json","git_blob_sha":"01c587c51ff71b8577a523f73098fc9f7c1c689c"},"coverage":{"occupational_baseline":true,"domain_framework":false,"observed_practice":false,"body_review":true},"source_versions":[{"source_id":"onet-31.0","version":"31.0 (August 2026)","use_mode":"adapted"}],"crosswalks":[{"source_id":"onet-31.0","external_id":"13-2054.00","label":"Financial Risk Specialists","concept_type":"occupation","relation":"partial","confidence":"medium","rationale":"Financial Risk Specialists is a bounded occupational baseline for Risk Manager; AXM profession identity/authority/maturity remain separate."}],"findings":[{"id":"risk-manager-occupational-boundary","layer":"methodology","summary":"Risk Management must keep risk models/scores, specialist evidence and authorized risk acceptance as separate layers.","source_ids":["onet-31.0"],"method_labels":["O*NET 31.0 occupational comparison"],"transferability":"bounded","body_action":"repair-candidate","body_area":"maps/evidence","rationale":"Research-first compilation makes the boundary explicit before use."}],"gaps_against_body":[{"id":"risk-manager-boundary-gap","body_area":"maps/evidence","description":"Make score-versus-truth, cross-domain aggregation and risk-acceptance-owner boundaries explicit.","evidence_source_ids":["onet-31.0"],"proposed_action":"add-handoff","priority":"high","safety_or_authority_impact":true}],"contradictions":[],"nonclaims":["No complete Risk Manager reconstruction is claimed.","No TEST/WORKING/CANON or adjacent institutional authority is created."],"high_stakes":{"is_high_stakes":false,"authorization_nonclaim":"No role label, package, model capability, repository permission or coordination function creates constitutional, product, professional or institutional authority."}}