{"schema_version":"0.1","profession_id":"technical-program-manager","research_state":"BODY_REVIEWED","researched_on":"2026-09-12","body_snapshot":{"repository":"mike-axiom-mir/axm-profession-fabric","ref":"growth/adjacent-software-cohort-65-70","path":"professions/operations/technical-program-manager/body.json","git_blob_sha":"3ba528a0bed8ee157e4012b2ce6d1dbe3cf15cec"},"coverage":{"occupational_baseline":true,"domain_framework":false,"observed_practice":false,"body_review":true},"source_versions":[{"source_id":"onet-31.0","version":"31.0 (August 2026)","use_mode":"adapted"}],"crosswalks":[{"source_id":"onet-31.0","external_id":"13-1082.00","label":"Project Management Specialists","concept_type":"occupation","relation":"partial","confidence":"high","rationale":"Project management grounds schedule/stakeholder/dependency coordination."},{"source_id":"onet-31.0","external_id":"15-1211.00","label":"Computer Systems Analysts","concept_type":"occupation","relation":"adjacent","confidence":"medium","rationale":"Systems analysis grounds technical dependency context without transferring technical acceptance."}],"findings":[{"id":"technical-program-manager-occupational-boundary","layer":"methodology","summary":"Technical program coordination is useful when dependency, schedule, risk and decision state stays source-linked and never overwrites specialist truth or turns coordination into technical authority.","source_ids":["onet-31.0"],"method_labels":["O*NET 31.0 occupational comparison"],"transferability":"bounded","body_action":"repair-candidate","body_area":"maps/evidence","rationale":"Research-first compilation makes the specialist boundary explicit before use."}],"gaps_against_body":[{"id":"technical-program-manager-boundary-gap","body_area":"maps/evidence","description":"Make schedule-versus-completion-evidence and coordinator-versus-specialist-authority boundaries explicit.","evidence_source_ids":["onet-31.0"],"proposed_action":"add-handoff","priority":"high","safety_or_authority_impact":false}],"contradictions":[],"nonclaims":["No complete Technical Program Manager reconstruction is claimed.","Occupational mappings are evidence, not profession identity.","No TEST/WORKING/CANON or adjacent authority is created."],"high_stakes":{"is_high_stakes":false,"authorization_nonclaim":"No adjacent professional, user, legal, platform or institutional authority is created."}}