{"schema_version":"0.1","profession_id":"design-systems-specialist","research_state":"BODY_REVIEWED","researched_on":"2026-09-12","body_snapshot":{"repository":"mike-axiom-mir/axm-profession-fabric","ref":"growth/adjacent-software-cohort-65-70","path":"professions/product-design/design-systems-specialist/body.json","git_blob_sha":"2b2526f91270d60066978cd0e8fa22f3218a6f6b"},"coverage":{"occupational_baseline":true,"domain_framework":false,"observed_practice":false,"body_review":true},"source_versions":[{"source_id":"onet-31.0","version":"31.0 (August 2026)","use_mode":"adapted"}],"crosswalks":[{"source_id":"onet-31.0","external_id":"15-1255.00","label":"Web and Digital Interface Designers","concept_type":"occupation","relation":"partial","confidence":"high","rationale":"Interface design grounds reusable component and interaction-system work."},{"source_id":"onet-31.0","external_id":"15-1252.00","label":"Software Developers","concept_type":"occupation","relation":"adjacent","confidence":"medium","rationale":"Software development grounds implementation adjacency without transferring runtime authority."}],"findings":[{"id":"design-systems-specialist-occupational-boundary","layer":"methodology","summary":"Design-system work must preserve versioned shared contracts and migration evidence while keeping reusable consistency separate from product usability, accessibility, implementation and brand acceptance.","source_ids":["onet-31.0"],"method_labels":["O*NET 31.0 occupational comparison"],"transferability":"bounded","body_action":"repair-candidate","body_area":"maps/evidence","rationale":"Research-first compilation makes the specialist boundary explicit before use."}],"gaps_against_body":[{"id":"design-systems-specialist-boundary-gap","body_area":"maps/evidence","description":"Make shared-component-versus-product-acceptance and semantic-version/migration boundaries explicit before consuming design-system outputs.","evidence_source_ids":["onet-31.0"],"proposed_action":"add-handoff","priority":"high","safety_or_authority_impact":false}],"contradictions":[],"nonclaims":["No complete Design Systems Specialist reconstruction is claimed.","Occupational mappings are evidence, not profession identity.","No TEST/WORKING/CANON or adjacent authority is created."],"high_stakes":{"is_high_stakes":false,"authorization_nonclaim":"No adjacent professional, user, legal, platform or institutional authority is created."}}